,Building Name,Latitude,Longitude
0,UNIVERSITY OF TEXAS M.D. ANDERSON CANCER CENTER,29.707031355,-95.397077171
1,CHI ST LUKES HEALTH BAYLOR COLLEGE OF MEDICINE MEDICAL CENTER,29.707731164,-95.400444972
2,TEXAS CHILDREN'S HOSPITAL,29.707778479,-95.401652632
3,EAST HOUSTON REGIONAL MED CTR,29.772366973,-95.193346659
4,HOUSTON METHODIST CONTINUING CARE HOSPITAL,29.77679705,-95.716844165
5,ST. ANTHONY'S HOSPITAL,29.871493219,-95.342112491
6,ST. LUKE'S THE WOODLANDS HOSPITAL,30.205701769,-95.458133145
